{
  "contextVersion": "2.0.0",
  "purpose": "INTERPRETATION",
  "locale": "en-US",
  "issuedAt": "2026-09-08T00:00:00Z",
  "expiresAt": "2026-09-08T00:05:00Z",
  "engineVersions": {
    "serviceVersion": "synthetic-fixture-v1",
    "apiVersion": "v1",
    "sajuEngineVersion": "synthetic-fixture-v1",
    "astrologyEngineVersion": "synthetic-fixture-v1",
    "locationReferenceVersion": "synthetic-fixture-v1",
    "timezoneDataVersion": "synthetic-fixture-v1",
    "ephemerisProviderVersion": "synthetic-fixture-v1",
    "ephemerisDataVersion": "synthetic-fixture-v1"
  },
  "scoreVersion": "synthetic-fixture-v1",
  "configVersion": "synthetic-fixture-v1",
  "result": {
    "meta": {
      "requestId": "synthetic-request-only",
      "versions": {
        "serviceVersion": "synthetic-fixture-v1",
        "apiVersion": "v1",
        "sajuEngineVersion": "synthetic-fixture-v1",
        "astrologyEngineVersion": "synthetic-fixture-v1",
        "scoreVersion": "synthetic-fixture-v1",
        "configVersion": "synthetic-fixture-v1",
        "locationReferenceVersion": "synthetic-fixture-v1",
        "timezoneDataVersion": "synthetic-fixture-v1",
        "ephemerisProviderVersion": "synthetic-fixture-v1",
        "ephemerisDataVersion": "synthetic-fixture-v1"
      }
    },
    "overallScore": 60,
    "status": "GOOD",
    "resultConfidence": 1,
    "coverage": 1,
    "categories": {
      "ATTRACTION": {
        "score": 60,
        "status": "GOOD",
        "resultConfidence": 1,
        "coverage": 1
      },
      "EMOTION": {
        "score": 60,
        "status": "GOOD",
        "resultConfidence": 1,
        "coverage": 1
      },
      "COMMUNICATION": {
        "score": 60,
        "status": "GOOD",
        "resultConfidence": 1,
        "coverage": 1
      },
      "PASSION": {
        "score": 60,
        "status": "GOOD",
        "resultConfidence": 1,
        "coverage": 1
      },
      "STABILITY": {
        "score": 60,
        "status": "GOOD",
        "resultConfidence": 1,
        "coverage": 1
      },
      "HARMONY": {
        "score": 60,
        "status": "GOOD",
        "resultConfidence": 1,
        "coverage": 1
      },
      "SUPPORT": {
        "score": 60,
        "status": "GOOD",
        "resultConfidence": 1,
        "coverage": 1
      },
      "LONG_TERM": {
        "score": 60,
        "status": "GOOD",
        "resultConfidence": 1,
        "coverage": 1
      }
    },
    "features": [
      {
        "ruleId": "SYNTHETIC_RULE",
        "source": "ASTROLOGY",
        "subject": "PAIR",
        "category": "HARMONY",
        "direction": "POSITIVE",
        "signedValue": 1,
        "rawValue": 1,
        "baseWeight": 0.5,
        "confidence": 1,
        "period": {
          "type": "LIFETIME"
        },
        "metadata": {
          "planetA": "VENUS",
          "planetB": "MARS",
          "aspect": "TRINE",
          "ruleVariant": "Café"
        },
        "featureId": "ft_c03583aa163c57aaa3462408fda52704fea71c9d64c90385"
      }
    ],
    "warnings": []
  },
  "evidence": [
    {
      "ruleId": "SYNTHETIC_RULE",
      "source": "ASTROLOGY",
      "subject": "PAIR",
      "category": "HARMONY",
      "direction": "POSITIVE",
      "signedValue": 1,
      "rawValue": 1,
      "baseWeight": 0.5,
      "confidence": 1,
      "period": {
        "type": "LIFETIME"
      },
      "metadata": {
        "planetA": "VENUS",
        "planetB": "MARS",
        "aspect": "TRINE",
        "ruleVariant": "Café"
      },
      "featureId": "ft_c03583aa163c57aaa3462408fda52704fea71c9d64c90385"
    }
  ]
}
